<?xml version="1.0" encoding="UTF-8" ?>
<faculty_members xmlns:xsi="http://www.w3.org/2001/XMLSchema-instance" xsi:noNamespaceSchemaLocation="Faculty1.xsd">
	<faculty_member> <!-- Lorenzo Alvisi -->
		<name>
			<first_name>Lorenzo</first_name>
			<last_name>Alvisi</last_name>
		</name>
		<username>lorenzo</username>
		<faculty_type>Professor</faculty_type>
		<office>
			<building>
				<abbreviation>ACES</abbreviation>
				<long_name>Applied Computational Engineering and Sciences Building</long_name>
			</building>
			<room>6.244</room>
		</office>
		<email_addresses>
			<email>lorenzo@cs.utexas.edu</email>
		</email_addresses>
		<websites>
			<website>http://userweb.cs.utexas.edu/~lorenzo/</website>
		</websites>
		<phone_numbers>
			<phone_number>
				<phone_type>work</phone_type>
				<country_code>1</country_code>
				<area_code>512</area_code>
				<number>4719792</number>
			</phone_number>
			<phone_number>
				<phone_type>fax</phone_type>
				<country_code>1</country_code>
				<area_code>512</area_code>
				<number>2327886</number>
			</phone_number>
		</phone_numbers>
		<research_areas>
			<research_area>Distributed Computing</research_area>
		</research_areas>
		<degrees>
			<degree>
				<date_awarded>1996</date_awarded>
				<institution>Cornell</institution>
				<degree_type>Ph.D.</degree_type>
				<specialization>Computer Science</specialization>
			</degree>
			<degree>
				<date_awarded>1994</date_awarded>
				<institution>Cornell</institution>
				<degree_type>Master's</degree_type>
				<specialization>Computer Science</specialization>
			</degree>
			<degree>
				<date_awarded>1987</date_awarded>
				<institution>Università di Bologna, Italy</institution>
				<degree_type>Laurea</degree_type>
				<specialization>Physics</specialization>
			</degree>
		</degrees>
		<office_hours>
			<meeting_time_and_place>
				<start_time>16:00:00</start_time>
				<end_time>17:00:00</end_time>
				<location>
					<building>
						<abbreviation>ACES</abbreviation>
						<long_name>Applied Computational Engineering and Sciences Building</long_name>
					</building>
					<room>6.244</room>
				</location>
				<days>
					<day>Tuesday</day>
					<day>Thursday</day>
				</days>
			</meeting_time_and_place>
		</office_hours>
		<classes>
			<class>
				<unique_number>54375</unique_number>
				<name>Distributed Computing</name>
				<description>Models of distributed systems; language issues, proving properties of distributed systems; time, clocks, partial ordering of events; deadlock and termination detection; diffusing computations; computing in hostile environments; distributed resource management.</description>
				<course_number>
					<field_of_study>CS</field_of_study>
					<number>380D</number>
				</course_number>
				<semester>Spring</semester>
				<year>2010</year>
				<teaching_assistants>
					<name>
						<first_name>Apurv</first_name>
						<last_name>Bhartia</last_name>
					</name>
				</teaching_assistants>
				<meeting_times_and_places>
					<meeting_time_and_place>
						<start_time>17:00:00</start_time>
						<end_time>18:30:00</end_time>
						<location>
							<building>
								<abbreviation>RLM</abbreviation>
								<long_name>Robert Lee Moore</long_name>
							</building>
							<room>5.126</room>
						</location>
						<days>
							<day>Tuesday</day>
							<day>Thursday</day>
						</days>
					</meeting_time_and_place>
				</meeting_times_and_places>
			</class>
		</classes>
		<journal_articles>
			<article>
				<journal>ACM Trasactions on Computer Systems</journal>
				<title>Zyzzyva: Speculative Byzantine Fault Tolerance</title>
				<issue_date>2009-12</issue_date>
				<other_authors>
					<name>
						<first_name>R.</first_name>
						<last_name>Kotla</last_name>
					</name>
					<name>
						<first_name>A.</first_name>
						<last_name>Clement</last_name>
					</name>
					<name>
						<first_name>E.</first_name>
						<last_name>Wong</last_name>
					</name>
					<name>
						<first_name>M.</first_name>
						<last_name>Dahlin</last_name>
					</name>
				</other_authors>
			</article>
		</journal_articles>
		<conferences>
			<conference>
				<date>2009-11</date>
				<name>The 11th International Symposium on Stabilization, Safety, and Security of Distributed Systems (SSS 2009)</name>
				<location>Lyon, France</location>
				<presentation_title>Model Checking Coalition Nash Equilibria in MAD Distributed Systems</presentation_title>
			</conference>
		</conferences>
		<grad_students>
			<grad_student>
				<name>
					<first_name>Amitanand</first_name>
					<middle_name>S.</middle_name>
					<last_name>Aiyer</last_name>
				</name>
				<type>Ph.D.</type>
				<writings></writings>
			</grad_student>
		</grad_students>
	</faculty_member>
	<faculty_member> <!-- Inderjit S. Dhillon -->
		<name>
			<first_name>Inderjit</first_name>
			<middle_name>S.</middle_name>
			<last_name>Dhillon</last_name>
		</name>
		<faculty_type>Professor</faculty_type>
		<office>
			<building>
				<abbreviation>ACES</abbreviation>
				<long_name>Applied Computational Engineering and Sciences Building</long_name>
			</building>
			<room>2.332</room>
		</office>
		<email_addresses>
			<email>inderjit@cs.utexas.edu</email>
		</email_addresses>
		<websites>
			<website>http://userweb.cs.utexas.edu/~inderjit/</website>
		</websites>
		<phone_numbers>
			<phone_number>
				<phone_type>department</phone_type>
				<area_code>512</area_code>
				<number>4717316</number>
			</phone_number>
			<phone_number>
				<phone_type>work</phone_type>
				<area_code>512</area_code>
				<number>4719725</number>
			</phone_number>
			<phone_number>
				<phone_type>fax</phone_type>
				<area_code>512</area_code>
				<number>4718885</number>
			</phone_number>
		</phone_numbers>
		<classes>
			<class>
				<unique_number>54340</unique_number>
				<name>Introduction to Data Mining</name>
				<description>Only one of the following may be counted unless the topics vary: Computer Sciences 178, 378, 178H, 378H.</description>
				<course_number>
					<field_of_study>CS</field_of_study>
					<number>378</number>
				</course_number>
				<semester>Spring</semester>
				<year>2010</year>
				<meeting_times_and_places>
					<meeting_time_and_place>
						<start_time>09:30:00</start_time>
						<end_time>11:00:00</end_time>
						<location>
							<building>
								<abbreviation>TAY</abbreviation>
								<long_name>Taylor Hall</long_name>
							</building>
							<room>3.144</room>
						</location>
						<days>
							<day>Tuesday</day>
							<day>Thursday</day>
						</days>
					</meeting_time_and_place>
				</meeting_times_and_places>
			</class>
		</classes>
		<research_areas>
			<research_area>Data mining</research_area>
			<research_area>Machine learning</research_area>
			<research_area>Numerical linear algebra</research_area>
			<research_area>Scientific computing</research_area>
			<research_area>Numerical Optimization</research_area>
			<research_area>Bioinformatics</research_area>
		</research_areas>
		<degrees>
			<degree>
				<date_awarded>1989</date_awarded>
				<institution>Indian Institute of Technology at Bombay</institution>
				<degree_type>B. Tech</degree_type>
				<specialization>Computer Science and Engineering</specialization>
			</degree>
			<degree>
				<date_awarded>1997</date_awarded>
				<institution>University of California at Berkeley</institution>
				<degree_type>Ph.D.</degree_type>
				<specialization>Computer Science</specialization>
			</degree>
		</degrees>
		<published_books>
			<book>
				<title>ScaLAPACK Users’ Guide</title>
				<publisher>SIAM</publisher>
				<date_published>1997</date_published>
				<other_authors>
					<name>
						<first_name>L.</first_name>
						<last_name>Blackford</last_name>
					</name>
					<name>
						<first_name>J.</first_name>
						<last_name>Choi</last_name>
					</name>
					<name>
						<first_name>A.</first_name>
						<last_name>Cleary</last_name>
					</name>
					<name>
						<first_name>E.</first_name>
						<last_name>D'Azevedo</last_name>
					</name>
					<name>
						<first_name>J.</first_name>
						<last_name>Demmel</last_name>
					</name>
					<name>
						<first_name>J.</first_name>
						<last_name>Dongarra</last_name>
					</name>
					<name>
						<first_name>S.</first_name>
						<last_name>Hammarling</last_name>
					</name>
					<name>
						<first_name>G.</first_name>
						<last_name>Henry</last_name>
					</name>
					<name>
						<first_name>A.</first_name>
						<last_name>Petitet</last_name>
					</name>
					<name>
						<first_name>K.</first_name>
						<last_name>Stanley</last_name>
					</name>
					<name>
						<first_name>R.</first_name>
						<last_name>Whaley</last_name>
					</name>
					<name>
						<first_name>D.</first_name>
						<last_name>Walker</last_name>
					</name>
				</other_authors>
			</book>
		</published_books>
		<journal_articles>
			<article>
				<journal>Journal of Machine Learning Research(JMLR)</journal>
				<title>Low-Rank Kernel Learning with Bregman Matrix Divergences</title>
				<issue_date>2009-02</issue_date>
				<other_authors>
					<name>
						<first_name>B.</first_name>
						<last_name>Kuhlis</last_name>
					</name>
					<name>
						<first_name>M.</first_name>
						<last_name>Sustik</last_name>
					</name>
				</other_authors>
			</article>
		</journal_articles>
		<conferences>
			<conference>
				<date>2009-12</date>
				<name>Neural Information Processing Systems Conference (NIPS)</name>
				<location>Vancouver, Canada</location>
				<presentation_title>Matrix Completion from Power-Law Distributed Samples</presentation_title>
			</conference>
		</conferences>
		<grad_students>
			<grad_student>
				<name>
					<first_name>Dongmin</first_name>
					<last_name>Kim</last_name>
				</name>
				<type>Ph.D.</type>
			</grad_student>
		</grad_students>
	</faculty_member>
	<faculty_member> <!-- Warren A. Hunt, Jr. -->
		<name>
			<first_name>Warren</first_name>
			<middle_name>A.</middle_name>